,titre,contenu
50,Création d’un service public de la petite enfance,"Je souhaite que les jeunes parents, et notamment les mères isolées, puissent bénéficier d’un service public de garde d’enfants en cas d’horaires décalés. Ce nouveau service public de la petite enfance permettra de mener de front, et de façon sereine, sa vie parentale et sa vie active."
51,Grand plan national Sport et Santé,"Je propose le remboursement par la Sécurité Sociale  des activités sportives prescrites par un médecin pour les patients atteints d’une affection de longue durée (diabète, cancer, maladies cardio-vasculaires, obésité…) Je développerai l’accès au sport au travail, dans le privé et le public. J’encouragerai ainsi les comportements bénéfiques de nos concitoyens pour combattre les maladies chroniques."
52,Responsabilité des dirigeants d’entreprises,"Je créerai un statut des dirigeant.e.s de grandes entreprises afin de moraliser les pratiques : prohibition des rémunérations dépourvues de lien avec l’amélioration des résultats au cours de leur mandat, prohibition des stock options, fin des retraites chapeaux en cas de démission ou de perte de confiance du conseil d’administration. Je rendrai les dirigeant.e.s responsables en cas de pratiques managériales sources de souffrance avérée au travail."
53,Reconnaissance du droit à la déconnexion pour tous.tes,"Je reconnaîtrai le droit à la déconnexion effectif et pour tous.tes pour améliorer le bien-être au travail. Smartphones et ordinateurs sont devenus des « laisses électroniques ». Le mal-être au travail peut gagner le domicile. Il devient difficile de distinguer le temps du travail de celui de la vie personnelle, il faut donc de nouvelles règles pour protéger les salariés"
54,Un impôt unique sur le patrimoine net des dettes,"Je créerai un impôt unique sur le patrimoine, simple, et progressif. Il sera net des dettes pour éviter que celui qui s’est endetté soit aussi taxé que celui qui a tout reçu en héritage. Il comprendra notamment la taxe foncière et l’ISF. Les ménages français possèdent en 2016 plus de 10 000 milliards d’euros de patrimoine (net de dettes) mais la répartition de ce patrimoine est très inégalitaire. La taxe foncière et l’ISF sont aujourd’hui trop complexes, créent des distorsions et les ménages les plus aisés arrivent à les éviter."
55,Garantie d’un meilleur accès aux données publiques,"Je mènerai une politique d’open data et de transparence des données publiques. Je garantirai un large accès du public aux données conservées et traitées par les administrations publiques. Les citoyens, chercheurs et journalistes doivent connaître les données qui déterminent des choix politiques. Ces données peuvent être utilisées par les entreprises du numérique pour proposer de nouveaux services innovants. Je veillerai à ce que ces données ne soient pas appropriées par les GAFA (Google, Apple, Facebook, Amazon)."
56,Contrôle parlementaire des nominations présidentielles,"Je développerai le contrôle parlementaire sur les grandes décisions présidentielles (nominations dans les autorités indépendantes et certaines grandes entreprises, nominations de directeurs d’administration centrale, de recteurs, d’ambassadeur ou de préfet, autres nominations politiques pourvues en Conseil des Ministres)."
57,Respect de l’égalité salariale femmes-hommes,Je renforcerai les sanctions inscrites dans la loi (1 an d’emprisonnement et 3750 € d’amende) en cas de non respect de l’égalité salariale.
58,Une PAC verte pour accompagner la transition agricole,"Je négocierai au niveau européen pour qu’une partie de la Politique Agricole Commune soit consacrée au financement des agriculteurs prêts à adopter le modèle agroécologique. Ce modèle réduit l’usage des engrais et autres intrants, préserve les ressources naturelles et recourt aux circuits courts notamment."
59,Priorité de l’attribution du foncier agricole aux projets bio ou agroécologiques,"Je modifierai les critères de l’examen des dossiers de reprise d’exploitation afin de favoriser systématiquement les projets en agriculture biologique ou agroécologique. 40% des agriculteurs devraient partir à la retraite d’ici 2020, ils chercheront donc des repreneurs dans les années à venir. Il faut se saisir de ce moment pour engager une conversion de notre agriculture."
60,L’autonomie alimentaire grâce aux circuits courts,"Je favoriserai le développement de cultures maraichères aux abords des villes. Je soutiendrai aussi les associations favorisant les circuits courts comme les AMAP. Une telle mesure permettra de créer de véritables ceintures vertes autour des villes, de favoriser le développement des circuits courts et l’autonomie alimentaire, et donc de réduire la pollution liée aux transports."
61,Lancement d’un plan contre la maltraitance animale,"Je garantirai le respect des plus hautes exigences en matière de bien-être de l’animal, en toutes circonstances, et sans exception. Nos objectifs en matière de qualité de vie et de qualité de l’alimentation ne justifient pas les maltraitances qui se sont multipliées récemment dans les abattoirs, à des seules fins de rendement économique."
62,Vers une harmonisation fiscale en Europe,"Je ferai de l’harmonisation fiscale dans l’Union européenne une priorité. Je me battrai pour une harmonisation de l’assiette et un rapprochement des taux de l’impôt sur les sociétés, pour un taux plafond de la TVA et pour une harmonisation de la lutte contre la fraude et l’évasion fiscale. La France sera à l’initiative de la création d’un nouvel impôt européen sur les GAFA et les multinationales pour augmenter le budget de l’UE et renforcer ses marges de manoeuvre, notamment en termes d’investissements en faveur de la transition énergétique."
63,Pour un syndicalisme renforcé,Je renforcerai l’implication des syndicats dans la prise de décisions stratégiques et je garantirai leur accès exhaustif à l’information. J’encouragerai la syndicalisation par une grande campagne d’information dans les entreprises. Je mettrai en place un chèque syndical pour faciliter la syndicalisation en PME et pouvoir négocier à armes égales.
64,Sortie du budget de la défense des règles européennes de déficit,"J’exclurai le budget de la défense du calcul du déficit au sens des critères de Maastricht. Avec le Brexit, la France sera bientôt le seul pays de l’Union européenne à porter un effort budgétaire significatif en matière de défense. Or la défense française assure notre protection mais aussi celle de l’ensemble des Européens. C’est pourquoi la France ne devrait en aucun cas être pénalisée dans son effort de défense par les règles de gouvernance budgétaire de la zone euro. Dans un contexte où l’Amérique de Trump va se désengager du continent européen, l’UE doit prendre ses responsabilités et se donner les moyens de son autonomie stratégique et opérationnelle. "
65,L’Université au coeur de la méritocratie républicaine,"Je remettrai l’enseignement supérieur au coeur de l’ascension sociale. Son budget sera augmenté d’1 milliard d’euros pour un développement des universités sur les territoires qui soit plus équilibré et pour que chacune et chacun ait accès à un enseignement supérieur de qualité. A ce titre, je veux consacrer autant de moyens aux étudiants des universités qu’aux étudiants des grandes écoles, dans le cadre des COMUE. Je mettrai également en place une politique d’aide à la mobilité des étudiants, notamment en assurant la construction et la réhabilitation de 50 000 logements étudiants sur la mandature."
